[
  {
    "id": "a",
    "teks": "a",
    "pola": "V",
    "huruf": ["a"],
    "level": 1,
    "contoh_kata": ["aku", "apa", "api"]
  },
  {
    "id": "i",
    "teks": "i",
    "pola": "V",
    "huruf": ["i"],
    "level": 1,
    "contoh_kata": ["ibu", "ini", "itu"]
  },
  {
    "id": "u",
    "teks": "u",
    "pola": "V",
    "huruf": ["u"],
    "level": 1,
    "contoh_kata": ["ubi", "ular", "ulat"]
  },
  {
    "id": "e",
    "teks": "e",
    "pola": "V",
    "huruf": ["e"],
    "level": 1,
    "contoh_kata": ["kue", "enak", "enam"]
  },
  {
    "id": "o",
    "teks": "o",
    "pola": "V",
    "huruf": ["o"],
    "level": 1,
    "contoh_kata": ["radio", "oranye"]
  },
  {
    "id": "ba",
    "teks": "ba",
    "pola": "KV",
    "huruf": ["b", "a"],
    "level": 1,
    "contoh_kata": ["baca", "bahu", "baju"]
  },
  {
    "id": "bi",
    "teks": "bi",
    "pola": "KV",
    "huruf": ["b", "i"],
    "level": 1,
    "contoh_kata": ["bibi", "biru", "bisa"]
  },
  {
    "id": "bu",
    "teks": "bu",
    "pola": "KV",
    "huruf": ["b", "u"],
    "level": 1,
    "contoh_kata": ["buka", "buku", "bumi"]
  },
  {
    "id": "be",
    "teks": "be",
    "pola": "KV",
    "huruf": ["b", "e"],
    "level": 1,
    "contoh_kata": ["beli", "bebek", "becak"]
  },
  {
    "id": "bo",
    "teks": "bo",
    "pola": "KV",
    "huruf": ["b", "o"],
    "level": 1,
    "contoh_kata": ["bola", "botol"]
  },
  {
    "id": "ca",
    "teks": "ca",
    "pola": "KV",
    "huruf": ["c", "a"],
    "level": 1,
    "contoh_kata": ["baca", "kaca", "membaca"]
  },
  {
    "id": "ci",
    "teks": "ci",
    "pola": "KV",
    "huruf": ["c", "i"],
    "level": 1,
    "contoh_kata": ["cuci", "cicak", "kelinci"]
  },
  {
    "id": "cu",
    "teks": "cu",
    "pola": "KV",
    "huruf": ["c", "u"],
    "level": 1,
    "contoh_kata": ["cuci"]
  },
  {
    "id": "ce",
    "teks": "ce",
    "pola": "KV",
    "huruf": ["c", "e"],
    "level": 1,
    "contoh_kata": ["celana", "cepat"]
  },
  {
    "id": "co",
    "teks": "co",
    "pola": "KV",
    "huruf": ["c", "o"],
    "level": 1,
    "contoh_kata": ["cokelat"]
  },
  {
    "id": "da",
    "teks": "da",
    "pola": "KV",
    "huruf": ["d", "a"],
    "level": 1,
    "contoh_kata": ["dada", "dadu", "dahi"]
  },
  {
    "id": "di",
    "teks": "di",
    "pola": "KV",
    "huruf": ["d", "i"],
    "level": 1,
    "contoh_kata": ["di", "dia", "radio"]
  },
  {
    "id": "du",
    "teks": "du",
    "pola": "KV",
    "huruf": ["d", "u"],
    "level": 1,
    "contoh_kata": ["dadu", "dua", "madu"]
  },
  {
    "id": "de",
    "teks": "de",
    "pola": "KV",
    "huruf": ["d", "e"],
    "level": 1,
    "contoh_kata": ["desa", "delapan", "jendela"]
  },
  {
    "id": "do",
    "teks": "do",
    "pola": "KV",
    "huruf": ["d", "o"],
    "level": 1,
    "contoh_kata": []
  },
  {
    "id": "fa",
    "teks": "fa",
    "pola": "KV",
    "huruf": ["f", "a"],
    "level": 1,
    "contoh_kata": []
  },
  {
    "id": "fi",
    "teks": "fi",
    "pola": "KV",
    "huruf": ["f", "i"],
    "level": 1,
    "contoh_kata": []
  },
  {
    "id": "fu",
    "teks": "fu",
    "pola": "KV",
    "huruf": ["f", "u"],
    "level": 1,
    "contoh_kata": []
  },
  {
    "id": "fe",
    "teks": "fe",
    "pola": "KV",
    "huruf": ["f", "e"],
    "level": 1,
    "contoh_kata": []
  },
  {
    "id": "fo",
    "teks": "fo",
    "pola": "KV",
    "huruf": ["f", "o"],
    "level": 1,
    "contoh_kata": ["foto"]
  },
  {
    "id": "ga",
    "teks": "ga",
    "pola": "KV",
    "huruf": ["g", "a"],
    "level": 1,
    "contoh_kata": ["jaga", "tiga", "gajah"]
  },
  {
    "id": "gi",
    "teks": "gi",
    "pola": "KV",
    "huruf": ["g", "i"],
    "level": 1,
    "contoh_kata": ["gigi", "pagi", "gitar"]
  },
  {
    "id": "gu",
    "teks": "gu",
    "pola": "KV",
    "huruf": ["g", "u"],
    "level": 1,
    "contoh_kata": ["gula", "gunung", "minggu"]
  },
  {
    "id": "ge",
    "teks": "ge",
    "pola": "KV",
    "huruf": ["g", "e"],
    "level": 1,
    "contoh_kata": ["gereja", "gelas", "gemuk"]
  },
  {
    "id": "go",
    "teks": "go",
    "pola": "KV",
    "huruf": ["g", "o"],
    "level": 1,
    "contoh_kata": []
  },
  {
    "id": "ha",
    "teks": "ha",
    "pola": "KV",
    "huruf": ["h", "a"],
    "level": 1,
    "contoh_kata": ["hari", "matahari", "paha"]
  },
  {
    "id": "hi",
    "teks": "hi",
    "pola": "KV",
    "huruf": ["h", "i"],
    "level": 1,
    "contoh_kata": ["dahi", "hitam", "hidung"]
  },
  {
    "id": "hu",
    "teks": "hu",
    "pola": "KV",
    "huruf": ["h", "u"],
    "level": 1,
    "contoh_kata": ["bahu", "perahu", "tahu"]
  },
  {
    "id": "he",
    "teks": "he",
    "pola": "KV",
    "huruf": ["h", "e"],
    "level": 1,
    "contoh_kata": []
  },
  {
    "id": "ho",
    "teks": "ho",
    "pola": "KV",
    "huruf": ["h", "o"],
    "level": 1,
    "contoh_kata": []
  },
  {
    "id": "ja",
    "teks": "ja",
    "pola": "KV",
    "huruf": ["j", "a"],
    "level": 1,
    "contoh_kata": ["gereja", "jaga", "jari"]
  },
  {
    "id": "ji",
    "teks": "ji",
    "pola": "KV",
    "huruf": ["j", "i"],
    "level": 1,
    "contoh_kata": []
  },
  {
    "id": "ju",
    "teks": "ju",
    "pola": "KV",
    "huruf": ["j", "u"],
    "level": 1,
    "contoh_kata": ["baju", "keju", "jual"]
  },
  {
    "id": "je",
    "teks": "je",
    "pola": "KV",
    "huruf": ["j", "e"],
    "level": 1,
    "contoh_kata": ["jeruk"]
  },
  {
    "id": "jo",
    "teks": "jo",
    "pola": "KV",
    "huruf": ["j", "o"],
    "level": 1,
    "contoh_kata": []
  },
  {
    "id": "ka",
    "teks": "ka",
    "pola": "KV",
    "huruf": ["k", "a"],
    "level": 1,
    "contoh_kata": ["buka", "kaca", "kaki"]
  },
  {
    "id": "ki",
    "teks": "ki",
    "pola": "KV",
    "huruf": ["k", "i"],
    "level": 1,
    "contoh_kata": ["kaki", "kita", "kipas"]
  },
  {
    "id": "ku",
    "teks": "ku",
    "pola": "KV",
    "huruf": ["k", "u"],
    "level": 1,
    "contoh_kata": ["aku", "buku", "kuda"]
  },
  {
    "id": "ke",
    "teks": "ke",
    "pola": "KV",
    "huruf": ["k", "e"],
    "level": 1,
    "contoh_kata": ["ke", "keju", "kelapa"]
  },
  {
    "id": "ko",
    "teks": "ko",
    "pola": "KV",
    "huruf": ["k", "o"],
    "level": 1,
    "contoh_kata": ["kopi", "kota", "teko"]
  },
  {
    "id": "la",
    "teks": "la",
    "pola": "KV",
    "huruf": ["l", "a"],
    "level": 1,
    "contoh_kata": ["bola", "celana", "gula"]
  },
  {
    "id": "li",
    "teks": "li",
    "pola": "KV",
    "huruf": ["l", "i"],
    "level": 1,
    "contoh_kata": ["beli", "lima", "tali"]
  },
  {
    "id": "lu",
    "teks": "lu",
    "pola": "KV",
    "huruf": ["l", "u"],
    "level": 1,
    "contoh_kata": ["lupa", "lutut"]
  },
  {
    "id": "le",
    "teks": "le",
    "pola": "KV",
    "huruf": ["l", "e"],
    "level": 1,
    "contoh_kata": ["lele", "lemari", "televisi"]
  },
  {
    "id": "lo",
    "teks": "lo",
    "pola": "KV",
    "huruf": ["l", "o"],
    "level": 1,
    "contoh_kata": []
  },
  {
    "id": "ma",
    "teks": "ma",
    "pola": "KV",
    "huruf": ["m", "a"],
    "level": 1,
    "contoh_kata": ["lama", "lemari", "lima"]
  },
  {
    "id": "mi",
    "teks": "mi",
    "pola": "KV",
    "huruf": ["m", "i"],
    "level": 1,
    "contoh_kata": ["bumi", "kami", "minum"]
  },
  {
    "id": "mu",
    "teks": "mu",
    "pola": "KV",
    "huruf": ["m", "u"],
    "level": 1,
    "contoh_kata": ["kamu", "muka", "mulut"]
  },
  {
    "id": "me",
    "teks": "me",
    "pola": "KV",
    "huruf": ["m", "e"],
    "level": 1,
    "contoh_kata": ["kemeja", "meja", "melihat"]
  },
  {
    "id": "mo",
    "teks": "mo",
    "pola": "KV",
    "huruf": ["m", "o"],
    "level": 1,
    "contoh_kata": ["mobil", "motor", "monyet"]
  },
  {
    "id": "na",
    "teks": "na",
    "pola": "KV",
    "huruf": ["n", "a"],
    "level": 1,
    "contoh_kata": ["celana", "nasi", "pena"]
  },
  {
    "id": "ni",
    "teks": "ni",
    "pola": "KV",
    "huruf": ["n", "i"],
    "level": 1,
    "contoh_kata": ["ini"]
  },
  {
    "id": "nu",
    "teks": "nu",
    "pola": "KV",
    "huruf": ["n", "u"],
    "level": 1,
    "contoh_kata": ["menulis"]
  },
  {
    "id": "ne",
    "teks": "ne",
    "pola": "KV",
    "huruf": ["n", "e"],
    "level": 1,
    "contoh_kata": ["nenek"]
  },
  {
    "id": "no",
    "teks": "no",
    "pola": "KV",
    "huruf": ["n", "o"],
    "level": 1,
    "contoh_kata": []
  },
  {
    "id": "pa",
    "teks": "pa",
    "pola": "KV",
    "huruf": ["p", "a"],
    "level": 1,
    "contoh_kata": ["apa", "kelapa", "kepala"]
  },
  {
    "id": "pi",
    "teks": "pi",
    "pola": "KV",
    "huruf": ["p", "i"],
    "level": 1,
    "contoh_kata": ["api", "kopi", "pipi"]
  },
  {
    "id": "pu",
    "teks": "pu",
    "pola": "KV",
    "huruf": ["p", "u"],
    "level": 1,
    "contoh_kata": ["sapu", "garpu", "komputer"]
  },
  {
    "id": "pe",
    "teks": "pe",
    "pola": "KV",
    "huruf": ["p", "e"],
    "level": 1,
    "contoh_kata": ["pena", "pepaya", "perahu"]
  },
  {
    "id": "po",
    "teks": "po",
    "pola": "KV",
    "huruf": ["p", "o"],
    "level": 1,
    "contoh_kata": ["pohon"]
  },
  {
    "id": "ra",
    "teks": "ra",
    "pola": "KV",
    "huruf": ["r", "a"],
    "level": 1,
    "contoh_kata": ["kera", "perahu", "radio"]
  },
  {
    "id": "ri",
    "teks": "ri",
    "pola": "KV",
    "huruf": ["r", "i"],
    "level": 1,
    "contoh_kata": ["hari", "jari", "lari"]
  },
  {
    "id": "ru",
    "teks": "ru",
    "pola": "KV",
    "huruf": ["r", "u"],
    "level": 1,
    "contoh_kata": ["baru", "biru", "rusa"]
  },
  {
    "id": "re",
    "teks": "re",
    "pola": "KV",
    "huruf": ["r", "e"],
    "level": 1,
    "contoh_kata": ["gereja", "kereta", "sore"]
  },
  {
    "id": "ro",
    "teks": "ro",
    "pola": "KV",
    "huruf": ["r", "o"],
    "level": 1,
    "contoh_kata": ["roti"]
  },
  {
    "id": "sa",
    "teks": "sa",
    "pola": "KV",
    "huruf": ["s", "a"],
    "level": 1,
    "contoh_kata": ["bisa", "desa", "rusa"]
  },
  {
    "id": "si",